id,name,brand_name,description,release_year,concentration,image_url,top_notes,middle_notes,base_notes,accords,perfumer,gender,seasons
,조 말론 우드 세이지 앤 씨 솔트,Jo Malone,바다의 신선함과 해안가의 향취를 담고 있는 향수로 자연스럽고 상쾌한 바다 향기와 세이지의 허브향이 조화롭게 어우러져 있습니다.,2014,EDP,https://images.example.com/jo-malone-wood-sage-sea-salt.jpg,암브레트씨앗,바다소금,세이지,바다향,우디,Christine Nagel,Unisex,SPRING
,샤넬 No.5,Chanel,세계에서 가장 유명한 향수 중 하나로 알데하이드의 청량한 느낌과 우아한 꽃향기가 조화를 이룬 클래식 향수입니다.,1921,PARFUM,https://images.example.com/chanel-no5.jpg,알데하이드,네롤리,베르가못,장미,일랑일랑,재스민,샌달우드,바닐라,머스크,플로럴,앰버,Ernest Beaux,Female,FALL
,딥티크 필로시코스,Diptyque,무화과 나무의 모든 것을 표현한 향수로 잎사귀의 청량함, 무화과 열매의 달콤함, 나무 껍질의 우디함을 모두 담아냈습니다.,1996,EDT,https://images.example.com/diptyque-philosykos.jpg,무화과잎,무화과나무,코코넛,그린,우디,Olivia Giacobetti,Unisex,SUMMER
,톰 포드 터바코 바닐라,Tom Ford,부드러운 담배 잎과 달콤한 바닐라, 스파이시한 향신료가 어우러진 따뜻하고 관능적인 향수입니다.,2007,EDP,https://images.example.com/tom-ford-tobacco-vanille.jpg,담배잎,스파이시,드라이프루트,바닐라,코코아,통카빈,스파이시,스위트,바닐라,Olivier Gillotin,Unisex,WINTER
,바이레도 블랑쉬,Byredo,순수하고 깨끗한 느낌을 주는 향수로 흰 장미의 우아함과 머스크의 따뜻함이 조화를 이룹니다.,2009,EDP,https://images.example.com/byredo-blanche.jpg,알데하이드,장미,핑크페퍼,바이올렛,샌달우드,머스크,플로럴,클린,Ben Gorham,Female,SPRING 